INSERT INTO pointcloud_schemas (pcid, srid, compression, description) VALUES
  (90, 4326, 'none', 'Three doubles');
INSERT 0 1
INSERT INTO pointcloud_dimensions
    (pcid, dim_no, dim_name, interpretation, dim_scale, dim_offset, active, description)
  VALUES
  (90, 1, 'X', 'double', 1, 0, true, 'Easting'),
  (90, 2, 'Y', 'double', 1, 0, true, 'Northing'),
  (90, 3, 'Z', 'double', 1, 0, true, 'Elevation');
INSERT 0 3
SELECT asMFJSON(tpcpoint '230000005A000000000000000000F03F00000000000000400000000000000840000000@2024-01-01');
                                                                                asmfjson                                                                                
------------------------------------------------------------------------------------------------------------------------------------------------------------------------
 {"type":"MovingPCPoint","crs":{"type":"Name","properties":{"name":"EPSG:4326"}},"coordinates":[[1,2,3]],"datetimes":["2024-01-01T00:00:00-08"],"interpolation":"None"}
(1 row)

SELECT getX(pcpoint(90, 1, 2, 3)), getY(pcpoint(90, 1, 2, 3)),
  getZ(pcpoint(90, 1, 2, 3));
 getx | gety | getz 
------+------+------
    1 |    2 |    3
(1 row)

SELECT pcid(pcpoint(90, 1, 2, 3)), SRID(pcpoint(90, 1, 2, 3));
 pcid | srid 
------+------
   90 | 4326
(1 row)

SELECT ST_AsText(geometry(pcpatch(pcpoint(90, 1, 2, 3),
  pcpoint(90, 4, 5, 6))));
           st_astext            
--------------------------------
 MULTIPOINT Z ((1 2 3),(4 5 6))
(1 row)

SELECT pcpoint(90, 1, 2);
ERROR:  The number of coordinates must be the number of dimensions of the schema 90: 2 vs 3
INSERT INTO pointcloud_schemas (pcid, srid, compression) VALUES (91, 4326, 'none');
INSERT 0 1
INSERT INTO pointcloud_dimensions (pcid, dim_no, dim_name, interpretation) VALUES
  (91, 1, 'X', 'double'), (91, 2, 'Y', 'double'),
  (91, 3, 'Z', 'double'), (91, 4, 'Intensity', 'double');
INSERT 0 4
SELECT getX(pcpoint(91, ARRAY[1, 2, 3, 40]::float[])),
  getDim(pcpoint(91, ARRAY[1, 2, 3, 40]::float[]), 'Intensity');
 getx | getdim 
------+--------
    1 |     40
(1 row)

SELECT ST_AsText(geometry(pcpatch(91, ARRAY[1, 2, 3, 40, 4, 5, 6, 50]::float[])));
           st_astext            
--------------------------------
 MULTIPOINT Z ((1 2 3),(4 5 6))
(1 row)

SELECT pcpatch(91, ARRAY[1, 2, 3]::float[]);
ERROR:  The number of coordinates must be a whole number of points of the schema 91: 3 is not a multiple of 4
DELETE FROM pointcloud_schemas WHERE pcid = 91;
DELETE 1
SELECT pcpoint(999, 1, 2, 3);
ERROR:  No schema registered for pcid 999
INSERT INTO pointcloud_schemas (pcid, srid, compression) VALUES (92, 4326, 'none');
INSERT 0 1
INSERT INTO pointcloud_dimensions (pcid, dim_no, dim_name, interpretation) VALUES
  (92, 1, 'X', 'double'), (92, 2, 'Y', 'double'), (92, 3, 'Z', 'double');
INSERT 0 3
SELECT pcpatch(pcpoint(90, 1, 2, 3), pcpoint(92, 4, 5, 6));
ERROR:  Operation on pcpoint values with different schemas: 90 vs 92
DELETE FROM pointcloud_schemas WHERE pcid = 92;
DELETE 1
INSERT INTO pointcloud_dimensions (pcid, dim_no, dim_name, interpretation) VALUES
  (90, 1, 'W', 'double');
ERROR:  duplicate key value violates unique constraint "pointcloud_dimensions_pkey"
DETAIL:  Key (pcid, dim_no)=(90, 1) already exists.
INSERT INTO pointcloud_dimensions (pcid, dim_no, dim_name, interpretation) VALUES
  (90, 4, 'X', 'double');
ERROR:  duplicate key value violates unique constraint "pointcloud_dimensions_pcid_dim_name_key"
DETAIL:  Key (pcid, dim_name)=(90, X) already exists.
INSERT INTO pointcloud_dimensions (pcid, dim_no, dim_name, interpretation) VALUES
  (90, 4, 'W', 'float128');
ERROR:  new row for relation "pointcloud_dimensions" violates check constraint "pointcloud_dimensions_interpretation_check"
DETAIL:  Failing row contains (90, 4, W, float128, 1, 0, t, null).
INSERT INTO pointcloud_dimensions (pcid, dim_no, dim_name, interpretation) VALUES
  (90, 0, 'W', 'double');
ERROR:  new row for relation "pointcloud_dimensions" violates check constraint "pointcloud_dimensions_dim_no_check"
DETAIL:  Failing row contains (90, 0, W, double, 1, 0, t, null).
INSERT INTO pointcloud_dimensions (pcid, dim_no, dim_name, interpretation) VALUES
  (91, 1, 'X', 'double');
ERROR:  insert or update on table "pointcloud_dimensions" violates foreign key constraint "pointcloud_dimensions_pcid_fkey"
DETAIL:  Key (pcid)=(91) is not present in table "pointcloud_schemas".
SELECT pointCloudSchemaSRID(90), pointCloudSchemaCompression(90),
  pointCloudSchemaNDims(90);
 pointcloudschemasrid | pointcloudschemacompression | pointcloudschemandims 
----------------------+-----------------------------+-----------------------
                 4326 | none                        |                     3
(1 row)

UPDATE pointcloud_schemas SET compression = 'dimensional' WHERE pcid = 90;
UPDATE 1
SELECT pointCloudSchemaCompression(90);
 pointcloudschemacompression 
-----------------------------
 dimensional
(1 row)

UPDATE pointcloud_schemas SET compression = 'none' WHERE pcid = 90;
UPDATE 1
UPDATE pointcloud_dimensions SET active = false WHERE pcid = 90 AND dim_no = 3;
UPDATE 1
SELECT pointCloudSchemaNDims(90);
 pointcloudschemandims 
-----------------------
                     2
(1 row)

UPDATE pointcloud_dimensions SET active = true WHERE pcid = 90 AND dim_no = 3;
UPDATE 1
SELECT pointCloudSchemaSRID(999) IS NULL AS unknown_srid,
  pointCloudSchemaNDims(999) AS unknown_ndims;
 unknown_srid | unknown_ndims 
--------------+---------------
 t            |              
(1 row)

DELETE FROM pointcloud_schemas WHERE pcid = 90;
DELETE 1
SELECT count(*) FROM pointcloud_dimensions WHERE pcid = 90;
 count 
-------
     0
(1 row)

