INSERT INTO pointcloud_schemas (pcid, srid, compression, description) VALUES
  (90, 4326, 'none', 'Three doubles');
INSERT 0 1
INSERT INTO pointcloud_dimensions
    (pcid, position, name, interpretation, scale, "offset", active, description)
  VALUES
  (90, 1, 'X', 'double', 1, 0, true, 'Easting'),
  (90, 2, 'Y', 'double', 1, 0, true, 'Northing'),
  (90, 3, 'Z', 'double', 1, 0, true, 'Elevation');
INSERT 0 3
SELECT asMFJSON(tpcpoint '230000005A000000000000000000F03F00000000000000400000000000000840000000@2024-01-01');
                                                                                asmfjson                                                                                
------------------------------------------------------------------------------------------------------------------------------------------------------------------------
 {"type":"MovingPCPoint","crs":{"type":"Name","properties":{"name":"EPSG:4326"}},"coordinates":[[1,2,3]],"datetimes":["2024-01-01T00:00:00-08"],"interpolation":"None"}
(1 row)

INSERT INTO pointcloud_dimensions (pcid, position, name, interpretation) VALUES
  (90, 1, 'W', 'double');
ERROR:  duplicate key value violates unique constraint "pointcloud_dimensions_pkey"
DETAIL:  Key (pcid, "position")=(90, 1) already exists.
INSERT INTO pointcloud_dimensions (pcid, position, name, interpretation) VALUES
  (90, 4, 'X', 'double');
ERROR:  duplicate key value violates unique constraint "pointcloud_dimensions_pcid_name_key"
DETAIL:  Key (pcid, name)=(90, X) already exists.
INSERT INTO pointcloud_dimensions (pcid, position, name, interpretation) VALUES
  (90, 4, 'W', 'float128');
ERROR:  new row for relation "pointcloud_dimensions" violates check constraint "pointcloud_dimensions_interpretation_check"
DETAIL:  Failing row contains (90, 4, W, float128, 1, 0, t, null).
INSERT INTO pointcloud_dimensions (pcid, position, name, interpretation) VALUES
  (90, 0, 'W', 'double');
ERROR:  new row for relation "pointcloud_dimensions" violates check constraint "pointcloud_dimensions_position_check"
DETAIL:  Failing row contains (90, 0, W, double, 1, 0, t, null).
INSERT INTO pointcloud_dimensions (pcid, position, name, interpretation) VALUES
  (91, 1, 'X', 'double');
ERROR:  insert or update on table "pointcloud_dimensions" violates foreign key constraint "pointcloud_dimensions_pcid_fkey"
DETAIL:  Key (pcid)=(91) is not present in table "pointcloud_schemas".
SELECT pointCloudSchemaSRID(90), pointCloudSchemaCompression(90),
  pointCloudSchemaNDims(90);
 pointcloudschemasrid | pointcloudschemacompression | pointcloudschemandims 
----------------------+-----------------------------+-----------------------
                 4326 | none                        |                     3
(1 row)

UPDATE pointcloud_schemas SET compression = 'dimensional' WHERE pcid = 90;
UPDATE 1
SELECT pointCloudSchemaCompression(90);
 pointcloudschemacompression 
-----------------------------
 dimensional
(1 row)

UPDATE pointcloud_schemas SET compression = 'none' WHERE pcid = 90;
UPDATE 1
UPDATE pointcloud_dimensions SET active = false WHERE pcid = 90 AND position = 3;
UPDATE 1
SELECT pointCloudSchemaNDims(90);
 pointcloudschemandims 
-----------------------
                     2
(1 row)

UPDATE pointcloud_dimensions SET active = true WHERE pcid = 90 AND position = 3;
UPDATE 1
SELECT pointCloudSchemaSRID(999) IS NULL AS unknown_srid,
  pointCloudSchemaNDims(999) AS unknown_ndims;
 unknown_srid | unknown_ndims 
--------------+---------------
 t            |              
(1 row)

DELETE FROM pointcloud_schemas WHERE pcid = 90;
DELETE 1
SELECT count(*) FROM pointcloud_dimensions WHERE pcid = 90;
 count 
-------
     0
(1 row)

